{
  "map": "rookguard",
  "schema_version": 1,
  "mechanics": null,
  "placements": [
    {
      "id": "rookguard:floor_cobble_01:4:2:0",
      "asset_id": "floor_cobble_01",
      "x": 4,
      "y": 2
    },
    {
      "id": "rookguard:floor_cobble_01:6:2:0",
      "asset_id": "floor_cobble_01",
      "x": 6,
      "y": 2
    },
    {
      "id": "rookguard:notice_board:9:5:0",
      "asset_id": "notice_board",
      "x": 9,
      "y": 5
    },
    {
      "id": "rookguard:bench:3:5:0",
      "asset_id": "bench",
      "x": 3,
      "y": 5
    },
    {
      "id": "rookguard:banner_blue:1:5:0",
      "asset_id": "banner_blue",
      "x": 1,
      "y": 5
    },
    {
      "id": "rookguard:rookguard_amber_lantern:5:6:0",
      "asset_id": "rookguard_amber_lantern",
      "x": 5,
      "y": 6
    },
    {
      "id": "rookguard:rookguard_supply_sack:6:6:0",
      "asset_id": "rookguard_supply_sack",
      "x": 6,
      "y": 6
    },
    {
      "id": "rookguard:rookguard_waymarker:7:6:0",
      "asset_id": "rookguard_waymarker",
      "x": 7,
      "y": 6
    },
    {
      "id": "rookguard:rookguard_fishing_post:10:6:0",
      "asset_id": "rookguard_fishing_post",
      "x": 10,
      "y": 6
    },
    {
      "id": "rookguard:rookguard_bait_crate:9:6:0",
      "asset_id": "rookguard_bait_crate",
      "x": 9,
      "y": 6
    },
    {
      "id": "rookguard:rookguard_canal_reeds:11:7:0",
      "asset_id": "rookguard_canal_reeds",
      "x": 11,
      "y": 7
    },
    {
      "id": "rookguard:door_wood_closed_south:14:5:0",
      "asset_id": "door_wood_closed_south",
      "x": 14,
      "y": 5
    },
    {
      "id": "rookguard:weapon_rack:13:4:0",
      "asset_id": "weapon_rack",
      "x": 13,
      "y": 4
    },
    {
      "id": "rookguard:bookshelf:17:3:0",
      "asset_id": "bookshelf",
      "x": 17,
      "y": 3
    },
    {
      "id": "rookguard:banner_red:18:2:0",
      "asset_id": "banner_red",
      "x": 18,
      "y": 2
    },
    {
      "id": "rookguard:slime_pool:14:14:0",
      "asset_id": "slime_pool",
      "x": 14,
      "y": 14
    },
    {
      "id": "rookguard:weapon_rack:12:17:1",
      "asset_id": "weapon_rack",
      "x": 12,
      "y": 17
    },
    {
      "id": "rookguard:floor_cobble_01:1:2:0",
      "asset_id": "floor_cobble_01",
      "x": 1,
      "y": 2
    },
    {
      "id": "rookguard:floor_cobble_01:2:2:0",
      "asset_id": "floor_cobble_01",
      "x": 2,
      "y": 2
    },
    {
      "id": "rookguard:floor_cobble_01:8:2:0",
      "asset_id": "floor_cobble_01",
      "x": 8,
      "y": 2
    },
    {
      "id": "rookguard:floor_cobble_01:9:2:0",
      "asset_id": "floor_cobble_01",
      "x": 9,
      "y": 2
    },
    {
      "id": "rookguard:wall_stone_north:12:1:0",
      "asset_id": "wall_stone_north",
      "x": 12,
      "y": 1
    },
    {
      "id": "rookguard:wall_stone_north:13:1:0",
      "asset_id": "wall_stone_north",
      "x": 13,
      "y": 1
    },
    {
      "id": "rookguard:wall_stone_north:14:1:0",
      "asset_id": "wall_stone_north",
      "x": 14,
      "y": 1
    },
    {
      "id": "rookguard:wall_stone_north:15:1:0",
      "asset_id": "wall_stone_north",
      "x": 15,
      "y": 1
    },
    {
      "id": "rookguard:wall_stone_north:16:1:0",
      "asset_id": "wall_stone_north",
      "x": 16,
      "y": 1
    },
    {
      "id": "rookguard:wall_stone_north:17:1:0",
      "asset_id": "wall_stone_north",
      "x": 17,
      "y": 1
    },
    {
      "id": "rookguard:wall_stone_north:18:1:0",
      "asset_id": "wall_stone_north",
      "x": 18,
      "y": 1
    },
    {
      "id": "rookguard:floor_cobble_01:1:1:0",
      "asset_id": "floor_cobble_01",
      "x": 1,
      "y": 1
    },
    {
      "id": "rookguard:floor_cobble_01:2:1:0",
      "asset_id": "floor_cobble_01",
      "x": 2,
      "y": 1
    },
    {
      "id": "rookguard:floor_cobble_01:3:1:0",
      "asset_id": "floor_cobble_01",
      "x": 3,
      "y": 1
    },
    {
      "id": "rookguard:floor_cobble_01:4:1:0",
      "asset_id": "floor_cobble_01",
      "x": 4,
      "y": 1
    },
    {
      "id": "rookguard:floor_cobble_01:5:1:0",
      "asset_id": "floor_cobble_01",
      "x": 5,
      "y": 1
    },
    {
      "id": "rookguard:floor_cobble_01:6:1:0",
      "asset_id": "floor_cobble_01",
      "x": 6,
      "y": 1
    },
    {
      "id": "rookguard:floor_cobble_01:7:1:0",
      "asset_id": "floor_cobble_01",
      "x": 7,
      "y": 1
    },
    {
      "id": "rookguard:floor_cobble_01:8:1:0",
      "asset_id": "floor_cobble_01",
      "x": 8,
      "y": 1
    },
    {
      "id": "rookguard:floor_cobble_01:9:1:0",
      "asset_id": "floor_cobble_01",
      "x": 9,
      "y": 1
    },
    {
      "id": "rookguard:floor_cobble_01:10:1:0",
      "asset_id": "floor_cobble_01",
      "x": 10,
      "y": 1
    },
    {
      "id": "rookguard:floor_cobble_01:1:3:0",
      "asset_id": "floor_cobble_01",
      "x": 1,
      "y": 3
    },
    {
      "id": "rookguard:floor_cobble_01:2:3:0",
      "asset_id": "floor_cobble_01",
      "x": 2,
      "y": 3
    },
    {
      "id": "rookguard:floor_cobble_01:3:3:0",
      "asset_id": "floor_cobble_01",
      "x": 3,
      "y": 3
    },
    {
      "id": "rookguard:floor_cobble_01:4:3:0",
      "asset_id": "floor_cobble_01",
      "x": 4,
      "y": 3
    },
    {
      "id": "rookguard:floor_cobble_01:5:3:0",
      "asset_id": "floor_cobble_01",
      "x": 5,
      "y": 3
    },
    {
      "id": "rookguard:floor_cobble_01:6:3:0",
      "asset_id": "floor_cobble_01",
      "x": 6,
      "y": 3
    },
    {
      "id": "rookguard:floor_cobble_01:7:3:0",
      "asset_id": "floor_cobble_01",
      "x": 7,
      "y": 3
    },
    {
      "id": "rookguard:floor_cobble_01:8:3:0",
      "asset_id": "floor_cobble_01",
      "x": 8,
      "y": 3
    },
    {
      "id": "rookguard:floor_cobble_01:9:3:0",
      "asset_id": "floor_cobble_01",
      "x": 9,
      "y": 3
    },
    {
      "id": "rookguard:floor_cobble_01:10:3:0",
      "asset_id": "floor_cobble_01",
      "x": 10,
      "y": 3
    },
    {
      "id": "rookguard:floor_cobble_01:1:4:0",
      "asset_id": "floor_cobble_01",
      "x": 1,
      "y": 4
    },
    {
      "id": "rookguard:floor_cobble_01:2:4:0",
      "asset_id": "floor_cobble_01",
      "x": 2,
      "y": 4
    },
    {
      "id": "rookguard:floor_cobble_01:3:4:0",
      "asset_id": "floor_cobble_01",
      "x": 3,
      "y": 4
    },
    {
      "id": "rookguard:floor_cobble_01:4:4:0",
      "asset_id": "floor_cobble_01",
      "x": 4,
      "y": 4
    },
    {
      "id": "rookguard:floor_cobble_01:5:4:0",
      "asset_id": "floor_cobble_01",
      "x": 5,
      "y": 4
    },
    {
      "id": "rookguard:floor_cobble_01:6:4:0",
      "asset_id": "floor_cobble_01",
      "x": 6,
      "y": 4
    },
    {
      "id": "rookguard:floor_cobble_01:7:4:0",
      "asset_id": "floor_cobble_01",
      "x": 7,
      "y": 4
    },
    {
      "id": "rookguard:floor_cobble_01:8:4:0",
      "asset_id": "floor_cobble_01",
      "x": 8,
      "y": 4
    },
    {
      "id": "rookguard:floor_cobble_01:9:4:0",
      "asset_id": "floor_cobble_01",
      "x": 9,
      "y": 4
    },
    {
      "id": "rookguard:floor_cobble_01:10:4:0",
      "asset_id": "floor_cobble_01",
      "x": 10,
      "y": 4
    },
    {
      "id": "rookguard:floor_cobble_01:1:5:0",
      "asset_id": "floor_cobble_01",
      "x": 1,
      "y": 5
    },
    {
      "id": "rookguard:floor_cobble_01:2:5:0",
      "asset_id": "floor_cobble_01",
      "x": 2,
      "y": 5
    },
    {
      "id": "rookguard:floor_cobble_01:3:5:0",
      "asset_id": "floor_cobble_01",
      "x": 3,
      "y": 5
    },
    {
      "id": "rookguard:floor_cobble_01:4:5:0",
      "asset_id": "floor_cobble_01",
      "x": 4,
      "y": 5
    },
    {
      "id": "rookguard:floor_cobble_01:5:5:0",
      "asset_id": "floor_cobble_01",
      "x": 5,
      "y": 5
    },
    {
      "id": "rookguard:floor_cobble_01:6:5:0",
      "asset_id": "floor_cobble_01",
      "x": 6,
      "y": 5
    },
    {
      "id": "rookguard:floor_cobble_01:7:5:0",
      "asset_id": "floor_cobble_01",
      "x": 7,
      "y": 5
    },
    {
      "id": "rookguard:floor_cobble_01:8:5:0",
      "asset_id": "floor_cobble_01",
      "x": 8,
      "y": 5
    },
    {
      "id": "rookguard:floor_cobble_01:9:5:0",
      "asset_id": "floor_cobble_01",
      "x": 9,
      "y": 5
    },
    {
      "id": "rookguard:floor_cobble_01:10:5:0",
      "asset_id": "floor_cobble_01",
      "x": 10,
      "y": 5
    },
    {
      "id": "rookguard:floor_cobble_01:1:6:0",
      "asset_id": "floor_cobble_01",
      "x": 1,
      "y": 6
    },
    {
      "id": "rookguard:floor_cobble_01:2:6:0",
      "asset_id": "floor_cobble_01",
      "x": 2,
      "y": 6
    },
    {
      "id": "rookguard:floor_cobble_01:3:6:0",
      "asset_id": "floor_cobble_01",
      "x": 3,
      "y": 6
    },
    {
      "id": "rookguard:floor_cobble_01:4:6:0",
      "asset_id": "floor_cobble_01",
      "x": 4,
      "y": 6
    },
    {
      "id": "rookguard:floor_cobble_01:5:6:0",
      "asset_id": "floor_cobble_01",
      "x": 5,
      "y": 6
    },
    {
      "id": "rookguard:floor_cobble_01:6:6:0",
      "asset_id": "floor_cobble_01",
      "x": 6,
      "y": 6
    },
    {
      "id": "rookguard:floor_cobble_01:7:6:0",
      "asset_id": "floor_cobble_01",
      "x": 7,
      "y": 6
    },
    {
      "id": "rookguard:floor_cobble_01:8:6:0",
      "asset_id": "floor_cobble_01",
      "x": 8,
      "y": 6
    },
    {
      "id": "rookguard:floor_cobble_01:9:6:0",
      "asset_id": "floor_cobble_01",
      "x": 9,
      "y": 6
    },
    {
      "id": "rookguard:floor_cobble_01:10:6:0",
      "asset_id": "floor_cobble_01",
      "x": 10,
      "y": 6
    },
    {
      "id": "rookguard:floor_stone_01:11:1:0",
      "asset_id": "floor_stone_01",
      "x": 11,
      "y": 1
    },
    {
      "id": "rookguard:floor_stone_01:12:1:0",